<?xml version="1.0"?>
<?xml-stylesheet type="text/xsl" href="../html.xsl"?>
<unit
	xmlns="http://cbear.berlios.de/cpp"
	xmlns:xsi="http://www.w3.org/2001/XMLSchema-instance"
	xsi:schemaLocation="http://cbear.berlios.de/cpp ../main.xsd"
	xmlns:html="http://www.w3.org/1999/xhtml"
	id="net/sourceforge/cbear/cpp/examples/empty">

<header>
	<method id="A">
		<body>
			<try>
				<body/>
				<catch>
					<parameter><id.ref id="int"/></parameter>
					<body/>
				</catch>
				<catch>
					<parameter><id.ref id="..."/></parameter>
					<body/>
				</catch>
			</try>
		</body>
	</method>
</header>

<code>
</code>

</unit>
