<?xml version="1.0"?>
<?xml-stylesheet type="text/xsl" href="../cpp/html.xsl"?>
<unit 
	xmlns="http://cbear.berlios.de/cpp" 
	id="cbear.berlios.de/range/end"
	xmlns:xsi="http://www.w3.org/2001/XMLSchema-instance"
	xsi:schemaLocation="http://cbear.berlios.de/cpp ../cpp/main.xsd">
<header>
<namespace id="cbear_berlios_de">
<namespace id="range">

<template>
	<id id="Container"/>
	<method id="end">
		<id.ref id="..."/>
		<parameter>
			<id.ref type="&amp;"><id.ref id="Container"/></id.ref>
		</parameter>
	</method>
</template>

<template>
	<id id="Container"/>
	<method id="end">
		<id.ref id="..."/>
		<parameter>
			<id.ref type="&amp;">
				<id.ref type="const"><id.ref id="Container"/></id.ref>
			</id.ref>
		</parameter>
	</method>
</template>

</namespace>
</namespace>
</header>
</unit>
