<?xml version="1.0"?>
<?xml-stylesheet type="text/xsl" href="../cpp/html.xsl"?>
<unit 
	xmlns="http://cbear.berlios.de/cpp" 
	id="cbear.berlios.de/range/reverse_iterator_range"
	xmlns:xsi="http://www.w3.org/2001/XMLSchema-instance"
	xsi:schemaLocation="http://cbear.berlios.de/cpp ../cpp/main.xsd">
<header>
<namespace id="cbear_berlios_de">
<namespace id="range">

<template>
	<id id="Iterator"/>
	<class>
		<id.ref id="reverse_iterator_range"/>
		<access access="public">
			<typedef id="type"><id.ref id="..."/></typedef>
		</access>
	</class>
</template>

	<template>
		<id id="Iterator"/>
		<method id="make_reverse_iterator_range">
			<id.ref id="..."/>
			<parameter>
				<id.ref type="&amp;">
					<id.ref type="const"><id.ref id="Iterator"/></id.ref>
				</id.ref>
			</parameter>
			<parameter>
				<id.ref type="&amp;">
					<id.ref type="const"><id.ref id="Iterator"/></id.ref>
				</id.ref>
			</parameter>
		</method>
	</template>

</namespace>
</namespace>
</header>
</unit>
