<?xml version="1.0"?>
<?xml-stylesheet type="text/xsl" href="../cpp/html.xsl"?>
<unit 
	xmlns="http://cbear.berlios.de/cpp" 
	id="cbear.berlios.de/range/pointer"
	xmlns:xsi="http://www.w3.org/2001/XMLSchema-instance"
	xsi:schemaLocation="http://cbear.berlios.de/cpp ../cpp/main.xsd">
<header>
<namespace id="cbear_berlios_de">
<namespace id="range">

<template>
	<id id="Container"/>
	<class>
		<id.ref id="pointer"/>
		<access access="public">
			<typedef id="type"><id.ref id="..."/></typedef>
		</access>
	</class>
</template>

</namespace>
</namespace>
</header>
</unit>
