<?xml version="1.0"?>
<?xml-stylesheet type="text/xsl" href="../html.xsl"?>
<unit
	xmlns="http://cbear.berlios.de/cpp"
	xmlns:xsi="http://www.w3.org/2001/XMLSchema-instance"
	xsi:schemaLocation="http://cbear.berlios.de/cpp ../main.xsd"
	xmlns:html="http://www.w3.org/1999/xhtml"
	id="net/sourceforge/cbear/cpp/examples/namespace">

<header>

<namespace id="net">
<namespace id="sourceforge">
<namespace id="cbear">
<namespace id="cpp">
<namespace id="examples">
</namespace>

</namespace>
</namespace>
</namespace>
</namespace>

</header>

<code>

<namespace id="net">
<namespace id="sourceforge">
<namespace id="cbear">
<namespace id="cpp">
<namespace id="examples">
</namespace>
</namespace>
</namespace>
</namespace>
</namespace>

</code>

</unit>
