<?xml version="1.0"?>
<!--
The MIT License

Copyright (c) 2005 C Bear (http://cbear.berlios.de)

Permission is hereby granted, free of charge, to any person obtaining a copy of 
this software and associated documentation files (the "Software"), to deal in 
the Software without restriction, including without limitation the rights to 
use, copy, modify, merge, publish, distribute, sublicense, and/or sell copies of
the Software, and to permit persons to whom the Software is furnished to do so, 
subject to the following conditions:

The above copyright notice and this permission notice shall be included in all 
copies or substantial portions of the Software.

THE SOFTWARE IS PROVIDED "AS IS", WITHOUT WARRANTY OF ANY KIND, EXPRESS OR 
IMPLIED, INCLUDING BUT NOT LIMITED TO THE WARRANTIES OF MERCHANTABILITY, FITNESS
FOR A PARTICULAR PURPOSE AND NONINFRINGEMENT. IN NO EVENT SHALL THE AUTHORS OR 
COPYRIGHT HOLDERS BE LIABLE FOR ANY CLAIM, DAMAGES OR OTHER LIABILITY, WHETHER 
IN AN ACTION OF CONTRACT, TORT OR OTHERWISE, ARISING FROM, OUT OF OR IN 
CONNECTION WITH THE SOFTWARE OR THE USE OR OTHER DEALINGS IN THE SOFTWARE.
-->
<?xml-stylesheet type="text/xsl" href="../cpp/html.xsl"?>
<unit 
	xmlns="http://cbear.berlios.de/cpp" 
	id="cbear.berlios.de/range/helper"
	xmlns:xsi="http://www.w3.org/2001/XMLSchema-instance"
	xsi:schemaLocation="http://cbear.berlios.de/cpp ../cpp/main.xsd">
<header>
<namespace id="cbear_berlios_de">
<namespace id="range">

<template>
	<id id="Container"/>
	<id id="Iterator"/>
	<id id="ConstIterator"/>
	<class>
		<id.ref id="helper"/>
		<access access="public">
			<typedef id="container"><id.ref id="Container"/></typedef>
			<typedef id="iterator"><id.ref id="Iterator"/></typedef>
			<typedef id="const_iterator"><id.ref id="ConstIterator"/></typedef>
			<typedef id="value_type"><id.ref id="..."/></typedef>
			<typedef id="difference_type"><id.ref id="..."/></typedef>
			<typedef id="size_type"><id.ref id="..."/></typedef>
			<typedef id="reference"><id.ref id="..."/></typedef>
			<typedef id="const_reference"><id.ref id="..."/></typedef>
			<typedef id="pointer"><id.ref id="..."/></typedef>
			<typedef id="const_pointer"><id.ref id="..."/></typedef>
			<typedef id="reverse_iterator"><id.ref id="..."/></typedef>
			<typedef id="const_reverse_iterator"><id.ref id="..."/></typedef>
			<method id="empty">
				<id.ref id="bool"/>
				<const/>
			</method>
			<method id="size">
				<id.ref id="size_type"/>
				<const/>
			</method>
			<method id="front">
				<id.ref id="reference"/>
			</method>
			<method id="front">
				<id.ref id="const_reference"/>
				<const/>
			</method>
			<method id="back">
				<id.ref id="reference"/>
			</method>
			<method id="back">
				<id.ref id="const_reference"/>
				<const/>
			</method>
			<method id="[]" type="operator">
				<id.ref id="reference"/>
				<parameter><id.ref id="size_type"/></parameter>
			</method>
			<method id="[]" type="operator">
				<id.ref id="const_reference"/>
				<parameter><id.ref id="size_type"/></parameter>
				<const/>
			</method>
			<method id="rbegin">
				<id.ref id="reverse_iterator"/>
			</method>
			<method id="rbegin">
				<id.ref id="const_reverse_iterator"/>
				<const/>
			</method>
			<method id="rend">
				<id.ref id="reverse_iterator"/>
			</method>
			<method id="rend">
				<id.ref id="const_reverse_iterator"/>
				<const/>
			</method>
		</access>
	</class>
</template>

</namespace>
</namespace>
</header>
</unit>
